sample_id,source,category,language,quality_expectation,description,file_path,source_url,author,license,lines_of_code,complexity,notes,date_added
oss_001,github,utility,python,good,Email validation function with regex,datasets/original_code/oss_001.py,https://github.com/example/repo,Open Source Contributor,MIT,12,low,,2025-11-29T16:00:55.780086
llm_001,llm_generated,utility,python,good,Efficient Fibonacci calculator (generated by Claude),datasets/original_code/llm_001.py,,Claude 3.5 Sonnet,unknown,23,low,,2025-11-29T16:00:55.780919
bad_001,intentionally_bad,data_processing,python,bad,Poor variable names and inefficient nested loops,datasets/original_code/bad_001.py,,unknown,unknown,8,medium,"Violates: naming conventions, efficiency, code clarity",2025-11-29T16:00:55.781259
llm_002,llm_generated,utility,python,good,Merge two sorted arrays (GPT-4 generated),datasets/original_code/llm_002.py,,GPT-4,unknown,26,medium,,2025-11-29T16:00:55.781564
bad_002,intentionally_bad,utility,python,bad,Missing error handling for division by zero,datasets/original_code/bad_002.py,,unknown,unknown,2,low,"Violates: error handling, input validation",2025-11-29T16:00:55.781876
